{
  "schema_version": "0.1.0",
  "workspace_id": "workspace_ember",
  "receipt_id": "receipt_withdrawal_001",
  "operation": "contributor_withdrawal",
  "subject_scope_digest": "2222222222222222222222222222222222222222222222222222222222222222",
  "requested_at": "2026-09-18T01:00:00Z",
  "completed_at": "2026-09-18T01:00:01Z",
  "status": "completed_with_external_actions_required",
  "policy_id": "policy_ember_safe",
  "policy_version": "1",
  "counts": {
    "source_snapshots": 1,
    "normalized_claims": 4,
    "relationship_edges": 4,
    "derived_results": 2,
    "exports": 1
  },
  "recomputation": {
    "required": true,
    "status": "completed",
    "impacted_run_count": 1
  },
  "external_actions_required": ["delete_user_copied_export"],
  "personal_values_included": false,
  "other_contributor_ids_included": false,
  "audit_chain_hash": "3333333333333333333333333333333333333333333333333333333333333333"
}
